#CODE;ENGLISH;FRENCH;GERMAN;;SPANISH;;;;;;;;;x
EVTDESC_lost_fixing2;As you go walking for a few more days you recognize that this area looks near to a place busy with many travellers, it would be a good choice now to do something about that and try and attract attention so you can leave this nightmare of being lost.;;;;;;;;;;;;;x
EVTOPTA_lost_fixing2;I do have a nice clay whistle...;;;;;;;;;;;;;x
EVTOPTB_lost_fixing2;Let us shout really loudly!;;;;;;;;;;;;;x
EVTOPTC_lost_fixing2;We should just go towards them...;;;;;;;;;;;;;x
EVTDESC_lost_fixing3;After a long while of being lost one of your courtiers who is more used to these woods then the others notices what might be an old trail which might lead you back into the main path of the hike, following it however could also leave you and your court even more lost.;;;;;;;;;;;;;x
EVTOPTA_lost_fixing3;Then let us follow that trail...;;;;;;;;;;;;;x
EVTOPTB_lost_fixing3;I don't want to get even more lost...;;;;;;;;;;;;;x
EVTDESC_lost_fixing_magical_1;While in the search for the trail, still lost, you see in the corner of your eye a magnificent beast, with its fur all in white and a smalll black tail, in its head sit horns as long as the trees and made out of the same material. For a minute or so you are perplexed at the sight and the memories of being lost fade away. The beast looks at you and its face is the face of a human with 3 eyes, then, it looks away and wanders off into the woods. In your heart you get the sense that you should follow it to whenever it is going towards...;;;;;;;;;;;;;x
EVTOPTA_lost_fixing_magic; Hey everyone... follow me...;;;;;;;;;;;;;x
EVTOPTB_lost_fixing_magic; My heart says something but my head says otherwise.;;;;;;;;;;;;;x
EVTDESC_lost_fixing_magical_2;While wandering, trying to find your way back to the trail, the setting sun begins to reveal ancient spirits of the forest to you. The small creatures, both immaterial and clay-like, wander about before focusing their non-existant sight onto you, mesmerized by you as you are by them. They all point towards a direction, where the woods turn more and more shrowded and the spirits pile up. You can make a run for it and trust these spirits, or turn the other way and hope that by averting their trickery you will find your way back.;;;;;;;;;;;;;x
EVTDESC_lostgoinghome;After such a long time being lost, a great number of your party is very convinced you wont be able to find your way back, but you might still be able to find the trail and resume your hike towards your destination.;;;;;;;;;;;;;x
EVTOPTA_lostgoinghome;We will manage I swear!;;;;;;;;;;;;;x
EVTOPTB_lostgoinghome;This is hopeless...;;;;;;;;;;;;;x
EVTDESC_gaianlostresultgood;Someway, somehow, you have managed to find yourself back into the trail of your Hike, your party is very glad and you can finally once again go back towards your destination.;;;;;;;;;;;;;x
EVTOPTA_gaianlostresultgood;Incredible, absolutely phenomenal.;;;;;;;;;;;;;x
EVTDESC_gaianlostresultbad;Even following your best efforts, you have once again failed to get back to the trail, your party remains lost, now somehow even more lost...;;;;;;;;;;;;;x
EVTOPTA_gaianlostresultbad;I am working on it ok?;;;;;;;;;;;;;x
EVTDESC_gaianlostresultforestfire;As you aproach the smoking area you begin to feel the heat... but now the fire is moving way too fast for you to run... You give a great shout of pain as the fire consumes you...;;;;;;;;;;;;;x
EVTOPTA_gaianlostresultforestfire;ARGHHHHHHHHHHHHHHHH;;;;;;;;;;;;;x

#druid boon events
ask_for_boon;Ask to inform realm direction;;;;;;;;;;;;;x
ask_for_boon_desc;Use your influence to ask the druids to take the realm in a specific direction most benefitial to you.;;;;;;;;;;;;;x
boon_tooltip_recent_boon;Has recently asked to help with realm direction.;;;;;;;;;;;;;x
EVTDESC_boon_choice;Your Druid has accepted your request to inform realm direction. You may now choose what specificically you will request.;;;;;;;;;;;;;x
EVTDESC_boon_denied;Your Druid has denied your request to inform realm direction, the affairs of the state are to be kept among their class.;;;;;;;;;;;;;x
EVTOPT_boon;Damn...;;;;;;;;;;;;;x
EVTOPTA_boon_stewardship;I want stewardship authorization over the realm.;;;;;;;;;;;;;x
EVTOPTB_boon_sponsorship;I need to build the respect of my figure.;;;;;;;;;;;;;x
EVTOPTC_boon_delegation;Some diplomatic work amongst other Gaians would be good...;;;;;;;;;;;;;x
EVTOPTD_boon_next;I desire something else...;;;;;;;;;;;;;x
EVTOPTA_boon_martial;We need to focus on expansion!;;;;;;;;;;;;;x
EVTOPTB_boon_defensive;We need to focus on defense!;;;;;;;;;;;;;x
EVTOPTC_boon_tax;We should focus on realm taxation...;;;;;;;;;;;;;x
official_stewardship_authorization;Official Stewardship Authorization;;;;;;;;;;;;;x
lost_official_diplomacy_authorization;Lost Diplomatic Authorization;;;;;;;;;;;;;x
druidic_delegation;Druidic Delegation;;;;;;;;;;;;;x
martial_land_focus;Offensive Training;;;;;;;;;;;;;x
defensive_land_focus;Defensive Training;;;;;;;;;;;;;x
tax_land_focus;Efficient Permanent Taxation;;;;;;;;;;;;;x
official_druid_sponsorship;Religious Propaganda;;;;;;;;;;;;;x
boon_timer;Recently directed realm focus;;;;;;;;;;;;;x
EVTDESC_boon_choice_discharge;Your Druid has accepted your request to inform realm direction, and has agreed to rescind your previous demotions.;;;;;;;;;;;;;x
EVTOPTA_boon_reinstate;I would like to be officially reinstated and recognized in my role as [Root.GetTitle].;;;;;;;;;;;;;x
EVTOPTB_diplomacy_auth;I will have my diplomatic privilages returned.;;;;;;;;;;;;;x

## druid screws you over events

refused_succ_law_change;Refused Law Change;;;;;;;;;;;;;x
EVTOPT_gaian_laws_succ_deny;I think otherwise!;;;;;;;;;;;;;x
EVTOPT_gaian_laws_succ_approve;I will abide by their wishes.;;;;;;;;;;;;;x
EVTDESC_gaian_succ_gavelkind;The leaders of the realm have decided it apropriate to request you to change the captaincy's succession law to gavelkind to reflect what they think would be the best for the realm.;;;;;;;;;;;;;x
EVTDESC_gaian_succ_mil_gaian_elective;The leaders of the realm have decided it apropriate to request you to change the captaincy's succession law to military selection to reflect what they think would be the best for the realm.;;;;;;;;;;;;;x
EVTDESC_gaian_succ_rel_gaian_elective;The leaders of the realm have decided it apropriate to request you to change the captaincy's succession law to learned appointment to reflect what they think would be the best for the realm.;;;;;;;;;;;;;x
EVTDESC_gaian_succ_eldership;The leaders of the realm have decided it apropriate to request you to change the captaincy's succession law to eldership to reflect what they think would be the best for the realm.;;;;;;;;;;;;;x


## Gaian Laws

captaincy_mobilization;Theocratic Mobilization;;;;;;;;;;;;;x
captaincy_mobilization_desc;These laws represent the level of militarization of a captaincy and of the religious establishment that controls it, representing the extent of its bureucracy dedicated for war.;;;;;;;;;;;;;x
captaincy_mobilization_0;Pacific;;;;;;;;;;;;;x
captaincy_mobilization_0_desc;This realm keeps its captains restricted, and the religious establishment is mostly dedicated to internal realm management and tax collection.;;;;;;;;;;;;;x
captaincy_mobilization_1;Versatile;;;;;;;;;;;;;x
captaincy_mobilization_1_desc;This realm is adaptative, and some liberties have been granted to its captains in the case of warfare.;;;;;;;;;;;;;x
captaincy_mobilization_2;Mobilized;;;;;;;;;;;;;x
captaincy_mobilization_2_desc;This realm is mobilized for warfare, the druidic management ensuring the functioning of the state is directing a good ammount of resources towards the military.;;;;;;;;;;;;;x
captaincy_mobilization_3;Militarized;;;;;;;;;;;;;x
captaincy_mobilization_3_desc;This realm is fully militarized, the captains have ample liberties to operate and collect from areas, focusing mostly on the maintance of a powerfull military force.;;;;;;;;;;;;;x


ze_gaian_vassal_wars;Internal Warfare;;;;;;;;;;;;;x
ze_gaian_vassal_wars_desc;These laws govern if the vassals of the captaincy can engage in internal warfare.;;;;;;;;;;;;;x
ze_gaian_vassal_wars_0;Allowed;;;;;;;;;;;;;x
ze_gaian_vassal_wars_0_desc;Internal warfare to solve disputes is allowed except when realm peace is enforced. Vassals keep extended levies for such conflicts.;;;;;;;;;;;;;x
ze_gaian_vassal_wars_1;Disallowed;;;;;;;;;;;;;x
ze_gaian_vassal_wars_1_desc;Internal warfare is disallowed.;;;;;;;;;;;;;x